term,guard,count,examples
kabmin,kabmin_foreign:Киргизия,14,"[""Важно, что в РФ и Киргизии хранят и бережно передают историческую память о ВОВ, заявил Михаил Мишустин на встрече с президентом Киргизии: 📌 Кабмин РФ оперативно обеспечит выполн..."", ""Акалбек Жапаров, председатель Кабмина Киргизии, совершенно правильно диагностировал проблему российской экономики: либо мы развиваем инновации, либо привлекаем среднеазиатских м..."", ""🥴 Возобновление авиарейса \""Екатеринбург – Тамчы\"" обсудили первый зампред кабмина Киргизии и замгубернатора Свердловской области РФ Данияр Амангельдиев и Василий Козлов на встреч..."", ""Мишустин принял участие в мероприятиях в рамках заседаний Евразийского межправительственного совета и Совета глав правительств Содружества Независимых Государств 7 июня прошли з..."", ""Авиасообщение Москвы с Бишкеком будет увеличено в 7 раз — Мишустин Кроме того, теперь мигранты заполонят не только столицу России. Премьер министр Мишустин на встрече с главой к..."", ""📝Низкоорбитный захват📝 До Киргизии добрался Маск Спутниковые системы Илона Маска «Старлинк» появятся и в Киргизии. Глава кабмина Адылбек Касымалиев на встрече в Вашингтоне со ст..."", ""📝Бесплатный сыр в британской мышеловке📝 попадутся ли в нее в Бишкеке? В рамках рабочего визита в Великобританию первый зампредседателя кабмина Киргизии Данияр Амангельдиев встре..."", ""📝Пошлины Трампа📝 Как в Средней Азии будут выкручиваться? Пока мировая экономика пытается прийти в себя из-за экономических решений Трампа, в Средней Азии уже смекнули, как извле...""]"
sovbez,sovbez_foreign:Косово,14,"[""‼️‼️‼️РФ будет помогать Белграду отстаивать законные национальные интересы в отношении Косово, опираясь на резолюции Совбеза ООН. МИД РФ"", ""⚡️Кабмин Сербии принял решение направить миссии НАТО запрос на возвращение сербских силовиков в Косово по резолюции Совбеза ООН 1244 — Вучич"", ""РФ будет помогать Белграду отстаивать законные национальные интересы в отношении Косово, опираясь на резолюции Совбеза ООН — МИД РФ"", ""Техника сербского спецназа на пути к Косово после срочного заседания Совета безопасности Сербии из-за угроз властей Косово силой убрать баррикады сербского населения частично пр..."", ""KFOR не пустили сербскую армию в Косово, игнорируя резолюцию Совбеза ООН 1244 — почему осуждать Запад за его методы бессмысленно Накануне Рождества, 6 января в 19:00, Сербия пол..."", ""❗️Кабмин Сербии направит миссии НАТО запрос на возвращение сербских силовиков в самопровозглашенное Косово по резолюции Совбеза ООН 1244 — президент Вучич"", ""❗️Москва будет помогать Белграду отстаивать законные национальные интересы в отношении Косово, опираясь на резолюции Совбеза ООН — МИД РФ"", ""⚡️Кабмин Сербии принял решение направить миссии НАТО запрос на возвращение сербских силовиков в Косово по резолюции Совбеза ООН 1244 — Вучич""]"
mizulina,mizulina_other_person,13,"[""Что самое смешное. Даже реально крутые адвокаты не всегда могут вписаться в тяжбы на чужой территории. Даже госорганы не берутся обращаться самостоятельно в чужие суды, несмотря..."", ""УНК ГУ МВД России по Москве в отношении Моргенштерна возбуждено административное производство по ч. 1 ст. 6.13 КоАП РФ (пропаганда либо незаконная реклама наркотических средств)..."", ""📌❗️⚡️ МАКСИМАЛЬНЫЙ РЕПОСТ!!! В ГОСДУМУ ВНЕСЕН ФУНДАМЕНТАЛЬНЫЙ ПРОСЕМЕЙНЫЙ ЗАКОНОПРОЕКТ! Сегодня в Госдуму внесен долгожданный для родительской общественности пакет законопроекто..."", ""Совет Федерации одобрил сегодня закон об обязательной геномной регистрации для всех осужденных, отбывающих наказание в виде лишения свободы, а также для подозреваемых, обвиняемы..."", ""Конечно новость дня - это проект запрета работы гипермаркетов. И тут понимаешь, что настоящий революционер тут - Елена Мизулина, а не Навальный. Навальный сплотил против себя ши..."", ""Попытка Елены Мизулиной говорить с читателями интернетов философскими категориями про \""свободу и самоограничение человека\"" конечно является ошибкой. Невежественные образованцы, ..."", ""Кастрации педофилов - быть? Накануне рабочая группа Совфеда под руководством сенатора Елены Мизулиной подготовила целый пакет законопроектов, направленных на системную защиту не..."", ""«Товарищи, вы будете смеяться, но нас опять постигла тяжелая утрата», – шутили про дикторов госТВ времен гонки на лафетах. Сейчас опять актуально, но шутки прочь. Смеяться – да,...""]"
sovbez,sovbez_foreign:Киргизия,13,"[""🖥️ Президент России Владимир Путин прибыл на заседание ОДКБ в столице Киргизии — Бишкеке. На заседании Совета коллективной безопасности ОДКБ будут подведены итоги взаимодействия..."", ""⚡️Местонахождение президента Киргизии Сооронбая Жээнбекова неизвестно - Совбез Киргизии"", ""🇷🇺 🇰🇬 🇹🇯 🇦🇲 В Ереван прибыли секретари Совбеза России, Киргизии и Таджикистана Они примут участие в заседании комитета секретарей СБ стран-членов ОДКБ, сообщает пресс-служба арм..."", ""Киргизия получила несколько зенитно-ракетных систем С-300, которые должны стать частью объединенной системы ПВО, - Совет безопасности Киргизии. Секретарь СБ Иманкулов выразил на..."", ""Киргизия не рассматривает возможность выхода из ОДКБ. Об этом заявил секретарь Совбеза Киргизии, который ранее предположил возможность исключения из организации Таджикистана. #О..."", ""Надо ввести правило, чтобы все проблемы, возникающие между странами ОДКБ, решались мирным путем. Если кто-то надеется силой решить проблемы, предлагаем, чтобы его исключали из о..."", ""Бишкек инициировал процедуру исключения Таджикистана из состава ОДКБ. /Совбез Киргизии/ UPD: секретарь Совбеза лишь предложил такую возможность #ОДКБ @new_militarycolumnist"", ""Эвакуация населения из приграничных киргизских сел при нынешнем конфликте с Таджикистаном была самой масштабной в истории страны. /секретарь Совбеза Киргизии Марат Иманкулов/ #К...""]"
sovbez,sovbez_foreign:Эстония,13,"[""❗️ В Совбезе России сообщили, что украинские спецслужбы и Запад активизировали кибератаки против РФ и ОДКБ. Против России при участии западных спецслужб действуют киберцентры в ..."", ""❗️ В Белоруссии заявили о провокациях на границе со стороны Украины и Польши Также провокации устраивают Литва, Латвия и Эстония, рассказал государственный секретарь Совета безо..."", ""Новостной обзор Пока мы спали, в новостях писали Российские СМИ: Российские издания, в том числе «Известия» и iz.ru, сохраняют формулировку Кремля — «специальная военная операци..."", ""А Эстония собирать свой совет безопасности будет три дня спустя..."", ""Эстония созывает заседание НАТО. Также сегодня по просьбе Эстонии состоится экстренное заседание Совета Безопасности ООН. Ранее в Москве Эстонию с ее истериками послали лесом."", ""🇪🇪Охранная полиция Эстонии (КаПо) опубликовала свой традиционный ежегодный отчет. Ничего сенсационного в нем нет — главной угрозой для государства остается Россия. Но в один ряд..."", ""Посол Эстонии в ООН Рейн Таммсаар разочарован тем, что, не видит способов выгнать Россию из ООН или исключить ее из состава Совета безопасности. Поэтому, Эстония будет добиватьс..."", ""Рубрика «А знаете ли Вы, что?»: по словам представителя Эстонии в ООН, не кто-нибудь , а именно Эстония ‼️ последние полтора года играла ведущую роль в решении всех без исключен...""]"
genprok,genprok_foreign:Беларусь,12,"[""Преступник понесёт наказание спустя 15 лет после убийства в московском «Конгресс-парке». Запутанная история останков на территории гостиницы на Староволынской началась в 2008 го..."", ""Пока наши говорят, обсуждают и спорят, белорусы – делают! Генпрокуратура Беларуси утвердила клинический протокол по применению химической кастрации и других средств для лечения ..."", ""⚡️ГУРСОПиК ЦА Следственного комитета Республики Беларусь возбудил уголовное дело по ч. 1 ст. 290-5 УК Республики Беларусь в отношении Степана Путило и Яна Рудика Все эти страшны..."", ""⚡️⚡️⚡️ Литва отказала в выдаче Беларуси Тихановской Генпрокуратура Беларуси"", ""Пока наши говорят, обсуждают и спорят, белорусы – делают! Генпрокуратура Беларуси утвердила клинический протокол по применению химической кастрации и других средств для лечения ..."", ""Для Беларуси киевский режим – это не весь украинский народ «Если информационного повода нет, то его нужно создать», – вот одно из правил, успешно используемое в современной PR-и..."", ""⚡️ГУРСОПиК ЦА Следственного комитета Республики Беларусь возбудил уголовное дело по ч. 1 ст. 290-5 УК Республики Беларусь в отношении Степана Путило и Яна Рудика Все эти страшны..."", ""По сообщению Генпрокуратуры Беларуси, телеграм-чат Gatovo признан экстремистскими материалами. Таким образом, теперь за распространение (репост) информации из этого источника гр...""]"
adm_prezidenta,ap_foreign:Иран,12,"[""Reuters: Трамп отвергает попытки начать переговоры о прекращении огня с Ираном Администрация президента Дональда Трампа отвергла попытки ближневосточных союзников начать диплома..."", ""США выдали 30-дневное разрешение на покупку российской нефти, находящейся под санкциями, сообщает Reuters со ссылкой на спецпредставителя президента РФ Кирилла Дмитриева. США вы..."", ""The Washington Post: США запросили у европейских союзников разведданные для возможных ударов по Ирану Администрация президента Трампа запросила у европейских союзников разведдан..."", ""The Wall Street Journal: Трамп обсудит с командой военные удары по Ирану Администрация президента Трампа готовит варианты силового ответа на продолжающиеся в Иране протесты. По ..."", ""IRNA: в офисе президента Ирана раскрыли подробности крушения вертолета Раиси Глава администрации президента Ирана Голам-Хоссейн Эсмаили, который находился в другом вертолете, со..."", ""ПУТИН | РОУХАНИ | ТЕЛЕФОННЫЙ РАЗГОВОР Об обмене опытом в борьбе с COVID-19, состоялся разговор президента Путина и с иранским лидером Роухани. /Администрация президента Ирана/"", ""Специально для истерички Винокуровой информация о положении женщин в Иране. Исламская революция позволила иранским женщинам активно участвовать во всех сферах общественной жизни..."", ""‼️🇮🇷 Иран откроет Ормузский пролив только после компенсации ущерба, нанесенного США и Израилем ▪️Об этом заявил замглавы администрации президента Ирана. ▪️Компенсацию планируют ...""]"
sovbez,sovbez_foreign:Евросоюз,12,"[""«О хищении российских активов Евросоюзом», — зампред Совбеза России Дмитрий Медведев «Если обезумевший Евросоюз попытается всë-таки украсть российские активы, заблокированные в ..."", ""❗️ЕС осуждает заявление России о размещении ядерного оружия на территории республики Белоруссии. ЕС на Совбезе ООН"", ""❗️Ночной международный дайджест 🇷🇺🇺🇦The Times опубликовало статью, в которой отмечаются успехи России в СВО за последние три недели. Издание отмечает, что до наступления зимы Ро..."", ""Спецназ входящих в НАТО Военно-морских сил Греции высадился на российский торговый корабль \""Адлер\"" в Средиземном море. «Солдаты НАТО» высадились на российское судно с вертолета,..."", ""❗️В Крыму сохраняется угроза террористических актов. Основные причины - антироссийская деятельность США, НАТО, ряда государств ЕС и Украины. /секретарь Совета безопасности Росси..."", ""В среду, 10 июня в Израиль должен прибыть министр иностранных дел Германии Хайко Маас. Как ожидается, он передаст Нетаньяху и Ганцу послание от Берлина, предостерегающее от одно..."", ""Медведев расширяет мир геополитических мемов — зампред Совбеза России тонко простебал ЕС после введения «потолка цен» на нефть Дмитрий Медведев показал в своем Telegram-канале, ..."", ""«Запад никак не может понять, что Россия адаптировалась к санкциям» — Медведев о восьмом пакете санкций ЕС Глава Совбеза РФ высказался о восьмом пакете санкций, который сегодня ...""]"
genprok,genprok_foreign:США,11,"[""🔥 Генпрокуратура США заявила, что по делу Эпштейна больше некому предъявить обвинения. Замгенпрокурора Тодд Бланш назвал ложными предположения о том, что у министерства юстиции ..."", ""А страсти бушуют действительно нешуточные. Предполагаю, что если гнида и его окружение не выполнят требования Трампа, будут введены жесткие санкции против гниды и его окружения,..."", ""Из Америки с любовью: Минюст США расследует причастность американских наемников к военным преступлениям на Донбассе В моем распоряжении оказался запрос Криминального отдела Упра..."", ""​​❗Чайка выступил за создание единого СК РФ по модели ФБР КАЛУГА, 15 июня. /ТАСС/. Генеральный прокурор России Юрий Чайка выступает за создание единого Следственного комитета в ..."", ""Из Америки с любовью: Минюст США расследует причастность американских наемников к военным преступлениям на Донбассе В моем распоряжении оказался запрос Криминального отдела Упра..."", ""Из Америки с любовью: Минюст США расследует причастность американских наемников к военным преступлениям на Донбассе В моем распоряжении оказался запрос Криминального отдела Упра..."", ""Из Америки с любовью: Минюст США расследует причастность американских наемников к военным преступлениям на Донбассе В моем распоряжении оказался запрос Криминального отдела Упра..."", ""Серый кардинал Молдовы вмешался в борьбу пророссийских и прозападных сил 11 июля пройдут досрочные парламентские выборы, инициированные президентом Молдовы, где идёт борьба прор...""]"
