term,guard,count,examples
_c,c_foreign:adj:украинск,35,"[""Хочется верить, что блокировка youtube-канала украинского пранкера Вольнова более реалистична, чем убийство Бабченко. @SIL0VIKI"", ""🖥️ Украинские Telegram-каналы сообщают об отключении света в нескольких районах Полтавы после атаки БПЛА и публикуют видео прилетов. Российские новые «Герани» работают по целям ..."", ""🐱 Забудьте слово Работино! Уже неделю по СМИ и соцсетям бродит устойчивый мэм \""штурм Работино\"" и люди ни дня не бывшие на фронте и не представляющие особенности этой войны напер..."", ""Итоги работы Цифровой Армии России за период 30/01-05/02 Видео отчет: YouTube RuTube Дзен Многие укропаблики стали закрывать комментарии, и это хорошо. Кстати, даже «Цензор», кр..."", ""​​Новая статья Комиссара Яррика опубликована Международной редакцией Федерального агентства новостей. В рамках специальной военной операции ВС России по демилитаризации и денаци..."", ""🇺🇦На фоне «контрнаступа» на Херсонском направлении, которое проходит в основном в телеграме, украинским журналистам усилили цензуру. Всех военных корреспондентов отозвали с фрон..."", ""Зачистка каналов ДНР и ЛНР на Ютубе Ночью с Ютуба удалили каналы: 🔹 УНМ ЛНР 🔹 УНМ ДНР 🔹 ГТРК ЛНР 🔹 ЛИЦ 🔹 Мининформ ДНР Также заблокировано сразу несколько украинских оппозиционн..."", ""Украинцы жалуются, что их власти угрожали закрыть Телеграм, а вместо этого, Телеграм заблокировал украинские боты по сбору информации и перемещениях и дислокации наших военных. ...""]"
boyarsky,boyarsky_other_person,34,"[""«Глупость!»: Николай Расторгуев оценил роды под песню «Любэ» В тюменском роддоме женщина восемь часов рожала под песню «Прорвемся!» группы «Любэ». Такую необычную услугу ей пред..."", ""Однажды на «Музыкальном ринге» пожилая женщина сказала Михаилу Боярскому, что вокальные данные у него не очень и что петь ему не стоит, а актер он хороший. Михаил Сергеевич отве..."", ""Народное творчество. Интерпретация песни Михаила Боярского «Дрессировщик». А также любительские, незабываемые, атмосферные кадры пейзажей Афганистана, снятые из кабины МИ-8. #пе..."", ""Народное творчество. Интерпретация песни Михаила Боярского \""Дрессировщик\"" А так же любительские, незабываемые, атмосферные кадры пейзажей Афганистана. Вид из кабины МИ-8. #песни..."", ""📺📺 Главное за день: 🟥Глава МЧС Александр Куренков сообщил Владимиру Путину о мерах, принимаемых для ликвидации ЧС федерального значения в Краснодарском крае; 🟥Владимир Путин соз..."", ""Владимир Путин наградил актера Михаила Боярского орденом \""За заслуги перед Отечеством\"" I степени."", ""Владимир Путин поздравил Михаила Боярского с 75-летием. «Ваш большой, многогранный талант, яркий артистический темперамент и неиссякаемая созидательная энергия позволили вам доб..."", ""В санкционный список Канады всего вошло 38 физических лиц и 16 организаций В обновленном списке антироссийских санкций на официальном сайте МИДа Канады появилось еще несколько и...""]"
kabmin,kabmin_foreign:adj:немецк,32,"[""🇩🇪 Если Россия не объявит сегодня о 30-дневном перемирии, подготовка к санкциям будет «запущена» — правительство Германии ➖«Часы тикают», - дерзко заявил пресс-секретарь немецко..."", ""🌐 ЧУЖИЕ ГОЛОСА: УТРЕННИЙ ОБЗОР 🇵🇱 «Onet.pl»: «миротворцы столкнутся с проблемами…» «Миротворцы не смогут установить мир, если нет воли к его установлению», - так заявил нам докт..."", ""⚡️⚡️⚡️⚡️⚡️Германия поставила на Украину ещё 25 танков Leopard 1A5, согласно данным сайта немецкого кабмина. Всего Берлин передал Киеву уже 115 таких машин. Примечательно, что в ..."", ""Протесты в Белоруссии. Главное к утру: — накануне прошли несколько акций, самая продолжительная — возле ИВС на Окрестина. Там люди, требовавшие освободить политзаключённых, разо..."", ""❗️ Обсуждения США и Британии решения о возможности ударов вглубь России не касаются оружия ФРГ, решение о непоставке ракет Taurus Киеву неизменно, заявил немецкий кабмин."", ""❗️Германия поставила на Украину еще 25 танков Leopard 1A5, следует из обновленного списка на сайте немецкого кабмина. Всего Берлин передал Киеву уже 115 таких машин."", ""❗️Германия не планирует поставлять истребители Украине, позиция по этому вопросу неизменна, а все дебаты излишни. Немецкий кабмин"", ""Ответы немецкого кабмина на запрос по Навальному вызывают еще больше вопросов, считает депутат бундестага Антон Фризен (\""Альтернатива для Германии\""). \""Почему объекты, зараженные...""]"
adm_prezidenta,ap_foreign:Казахстан,30,"[""Карим Масимов, которого задержали по делу о госизмене, принимал участие в заседании Совбеза 5 января Тогда он еще был председателем Комитета нацбезопасности Казахстана. После за..."", ""Даурен Абаев. Первый зам Руководителя Администрации Президента Казахстана о ситуации в стране и вводе миротворцев ОДКБ"", ""Со стороны террористов в Казахстане действовали снайперы со специальными винтовками - администрация президента Казахстана."", ""🇰🇿После внезапного назначения нового премьера, настало время поменять правительство. Что и было сделано вчера: 6 часов избирали, вернее, переизбирали: из 26 человек 21 сохранил ..."", ""🇰🇿 После назначения Олжаса Бектенова премьер-министром пришло время утверждения нового состава правительства республики Казахстан. Впрочем, «новый состав» – слишком громко сказа..."", ""\""Все проявления этнического высокомерия, попытки расшатать общественный порядок в Казахстане должны жестко пресекаться — президент Токаев\"". Учитывая, что все \""проявления этничес..."", ""Казахские ветераны боевых действий поддержали Куата Ахметова, унижающего русских в республике Скандально известный публикацией видеозаписей с извинениями русских перед казахами ..."", ""Первые успехи миротворческого контингента ОДКБ в Алма-Аты: освобожден и взят под контроль аэропорт, разбитый и разграбленный погромщиками, обеспечена безопасность консульства Ро...""]"
sovbez,sovbez_foreign:Польша,28,"[""❗️Польша обвинила Россию в нарушении воздушного пространства во время атаки БПЛА на Украину Польские военные подняли в небо истребители, а Оперативное командование ВС страны зая..."", ""У Польши есть 3 года, чтобы подготовиться к возможной конфронтации с Россией, — Дуда Также стало известно, что президент Польши созывает Совбез на тему Украины. Будут обсуждатьс..."", ""Польша собирает экстренный совет безопасности в 9:00 по мск на фоне опасений после утреннего инцидента — пресс-секретарь правительства Польши. Инцидент в том, что минувшей ночью..."", ""❗️ Если Украина хочет получить дальнобойные средства поражения, тогда России нужно будет организовать санитарный кордон до территории Польши — зампред Совбеза РФ Медведев."", ""⚡️Киев готов предоставить партнерам доказательства «российского следа» в ракетном ударе по Польше (с) секретарь Совета безопасности Украины Нас ждет обжигающая правда. В месте з..."", ""Мид Польши Сикорский в Совете Безопасности ООН: \""У меня к российскому правительству только одна просьба: если еще одна ракета или самолет без разрешения, намеренно или по ошибке..."", ""Автор аналитического Telegram-канала Варшавская русалка @pl_syrenka Накануне, когда стало известно, что около польского села Пшеводув упали две ракеты, некоторые серьёзно готови..."", ""В Польше созывают заседание Совета национальной безопасности в связи с ситуацией вокруг Украины и на восточном фланге НАТО. Также, в конце недели, официальная Варшава проведёт в...""]"
mincifry,mincifry_foreign:adj:украинск,27,"[""ВСУ начнут получать баллы за поражение российских целей Полученные баллы украинские военные смогут обменять на новые беспилотники, сообщает Politico со ссылкой на главу украинск..."", ""Тelegram восстановил работу ранее заблокированных украинских ботов В частности, речь идёт о ботах ГУР, СБУ, а также украинского Минцифры."", ""Новые необычные ударные дроны атаковали цели под Киевом. Сообщается, что у них совсем другой звук, чем у «Шахедов». Если у последних звук похож на мопед, то у новой разновидност..."", ""Воздушная тревога звучит в Киеве, а также Киевской и еще восьми областях Украины. Об этом свидетельствуют данные онлайн-карты украинского министерства цифровой трансформации."", ""❗️Воздушная тревога объявлена в Кировоградской, Днепропетровской и Харьковской областях Украины, а также на подконтрольной Киеву части Запорожской области. Это следует из данных..."", ""Telegram заблокировал украинские чат-боты, собиравшие данные о расположении российских войск и объектов Заблокирован бот \""Єворог\"", запущенный украинским Минцифры в 2022 году. Не..."", ""Воздушная тревога объявлена в шести областях Украины - власти Воздушная тревога объявлена в шести областях Украины, свидетельствуют данные онлайн-карты украинского министерства ..."", ""⚰️🇺🇦 Усиление мобилизации на Украине, повестки будут рассылать через \""Дию\"" (это, как у нас ГосУслуги) 📌 Это будет одним из направлений реформы ТЦК и усиления мобилизации, заявля...""]"
sovbez,sovbez_foreign:Германия,27,"[""🌐 ВРАЖЕСКИЕ ГОЛОСА: ВОКРУГ РОССИИ 🇩🇪 «ZDF»: «согласован дальнейший обмен пленными с Киевом» «По словам российского переговорщика, Россия и Украина договорились об очередном обме..."", ""❗️Россия созовет заседание СБ ООН по теме подрыва «Северных потоков» в «определенный момент». Об этом сообщает ТАСС со ссылкой на зампостпреда РФ при ООН Дмитрия Полянского. Он ..."", ""⚡️\""Северный поток 2\"" заморожен — глава МИД ФРГ Зампред Совбеза РФ Дмитрий Медведев после остановки сертификации \""Северного потока - 2\"" пообещал, что теперь Европа будет жить в н..."", ""❗️Ночной международный дайджест: 🇩🇪🇬🇧🇫🇷🇺🇸Welt: Советники по безопасности лидеров ФРГ, Британии и Франции отправились в Вашингтон с неанонсированным визитом для переговоров. 🇬🇧🇪🇺..."", ""🌐 ВРАЖЕСКИЕ ГОЛОСА: ВОКРУГ РОССИИ 🇩🇪 «ZDF»: «согласован дальнейший обмен пленными с Киевом» «По словам российского переговорщика, Россия и Украина договорились об очередном обме..."", ""Ситуация вокруг Израиля ▪️Нетаньяху заявил, что военная операция Израиля в секторе Газа вступила уже в третью фазу, которая включает расширение наземных операций в анклаве. ▪️Из..."", ""Представитель движения «Талибан» Сохейль Шахин заявил, что талибы против создания зоны безопасности в Кабуле для совершения гуманитарных операций. «В этом нет необходимости. Афг..."", ""Bloomberg: Россия готовит новое наступление на Украину По данным агентства, Москва не отказалась от планов полного захвата Донецкой и Луганской областей. Наступательная операция...""]"
genprok,genprok_foreign:adj:украинск,27,"[""Как сообщает пресс-служба Верховного суда РФ, в суд поступило административное исковое заявление генерального прокурора РФ о признании трех украинских националистических объедин..."", ""На Украине задержана подполковник СБУ за то, что она \""отрицала факты обстрела Запорожской АЭС войсками РФ\"", сообщает украинская Генпрокуратура. Также подполковник назвала постан..."", ""На Украине депутат от Винницы «купил» жену с инвалидностью в рабство ради отсрочки от мобилизации. В конце 2024 года он узнал о семье, где живёт 18-летняя девушка с инвалидность..."", ""Редизайн герба украинской генпрокуратуры https://colonelcassad.livejournal.com/3850267.html"", ""На Украине задержана подполковник СБУ за то, что она \""отрицала факты обстрела Запорожской АЭС войсками РФ\"" — украинская Генпрокуратура @belarusian_silovik"", ""Как сообщает пресс-служба Верховного суда РФ, в суд поступило административное исковое заявление генерального прокурора РФ о признании трех украинских националистических объедин..."", ""Коллектив WarGonzo – украинской генпрокуратуре Сегодня мы с восторгом узнали новость о том, что Вы заочно предъявили создателю и руководителю нашего телеграм-канала Семёну Пегов..."", ""\""Лучше 6 лет в тюрьме, чем смерть на фронте\"". Дезертирство приобретает массовый характер. За парадной риторикой о «стойкости ВСУ» скрывается неприятная правда, которую уже невоз...""]"
sovbez,sovbez_foreign:adj:американск,26,"[""США обвинили президента Сирии в ситуации в республике. Представитель Совета национальной безопасности (СНБ) американской администрации Шон Сэветт заявил, что в ситуации в Сирии ..."", ""В ФБР отказались отвечать на вопрос об участниках наркокартелей на Украине Федеральное бюро расследований (ФБР) США отказалось комментировать РИА Новости заявление Службы внешне..."", ""🇺🇸Пакет финансирования ЕС в 50 млрд для Украины не может заменить американскую помощь, заявил координатор Совета национальной безопасности по стратегическим коммуникациям Кирби."", ""Журналист и политолог Грегор Шпицен, автор Telegram-канала @Mecklenburger_Petersburger Газета Süddeutsche Zeitung за компанию с WDR, NDR и девятью другими международными партнёр..."", ""«Нападки Трампа на Китай вызывают волну националистической поддержки Си», - передает Bloomberg. Как пишет агентство, даже критики китайского лидера хотят, чтобы он был тверд пер..."", ""❗️США не планируют проводить ядерные испытания, заявил старший директор по контролю над вооружениями в американском Совете национальной безопасности Пранай Вадди. Он также заяви..."", ""Роман Антоновский, писатель, публицист, автор Telegram-канала «Сыны Монархии» @SonOfMonarchy «У нас и наших союзников нет ресурсов воевать с Россией. Ни глобально, ни локально» ..."", ""Довольно необычный, но от этого не менее серьезный источник наших полуофициальных комментариев ближневосточной обстановки: пресс-служба аппарата Совбеза. Продолжается активное н...""]"
