term,guard,count,examples
sovbez,sovbez_foreign:Венесуэла,5,"[""Президент Соединенных Штатов Дональд Трамп заявил о проведении «успешной и блестяще спланированной операции» в Венесуэле, захвате и вывозе за пределы страны лидера Николаса Маду..."", ""Власти Венесуэлы обратились к Совбезу ООН с просьбой созвать заседание из-за «продолжительной агрессии США» – Reuters."", ""☑️ ИТОГИ ДНЯ: СКАЗАНО С ТРИБУНЫ Дмитрий Медведев (Совбез РФ) – о Венесуэле и вооружении «Операция в Каракасе стала лучшим доказательством того факта, что любому государству надо..."", ""Василий Небензя, постпред России в ООН, прямо обвинил США в попытке государственного переворота в Венесуэле. Несмотря на это, Совбез проголосовал за предложение США обсудить сит..."", ""🇻🇪 🇺🇳 Власти Венесуэлы обратилась к Совбезу ООН с просьбой о заседании по поводу \""продолжительной агрессии США\"".""]"
adm_prezidenta,ap_foreign:adj:французск,5,"[""Париж приветствует готовность российского лидера к переговорам с Макроном. Об этом пишет французское издание Le Monde. «Французская администрация президента расценила как «приве..."", ""Зеленский встретится с Макроном в Париже в понедельник. Об этом сообщили в администрации французского президента. В повестке переговоров: вопросы гарантий безопасности для Украи..."", ""ГЛАВА АФРИКАНСКОЙ СТРАНЫ ЗВОНИЛ МАКРОНУ, ТРЕБУЯ ПОЯСНИТЬ «ЗА ПЕРЕВОРОТ В ПАРИЖЕ» Наша любимая тема: ИИ и политика Неоднократно писали о том, что чем круче будет становиться нейр..."", ""ЗУБОТЫЧИНА МАКРОНУ ОКАЗАЛАСЬ РЕАЛЬНОЙ Жена действительно ударила Макрона в начале его визита во Вьетнам. Сначала администрация французского президента пыталась представить эти к..."", ""Китай поставляет России нелетальную продукцию военного назначения, заявили в администрации французского президента. По мнению Парижа, сюда входят средства индивидуальной бронеза...""]"
sovbez,sovbez_foreign:leader:макрон,5,"[""📸 «Два брата-близнеца, Мерц и Макрон, — редкие уроды», — зампред Совбеза России Дмитрий Медведев. «Один жаждет мести. Другой, петух, боится \""хищника\"" у ворот и шантажирует Трамп..."", ""«Два брата-близнеца, Мерц и Макрон, — редкие уроды», — зампред Совбеза России Медведев. «Один жаждет мести. Другой, петух, боится \""хищника\"" у ворот и шантажирует Трампа с помощь..."", ""Президент Франции Эммануэль Макрон проведёт экстренное заседание Совета безопасности страны после второй ночи беспорядков, в ходе которых задержаны уже более 150 человек. #Франц..."", ""🇷🇺🐔🇫🇷 «Петушку Микрону» плевать на Францию, - Медведев ▪️Медведев жёстко прошёлся по Макрону, обозвав его «петушком Микроном» и заявил, что лошади русских казаков, вошедших в Па..."", ""🇷🇺🖕🇫🇷 «Два брата-близнеца, Мерц и Макрон, — редкие уроды», — зампред Совбеза России Медведев. ➖«Один жаждет мести. Другой, петух, боится \""хищника\"" у ворот и шантажирует Трампа с...""]"
kabmin,kabmin_foreign:Турция,5,"[""❗️ Пашинян и Путин договорились, что с 1 января пограничники Армении и РФ будут участвовать в охране границы с Ираном и Турцией, сообщает армянский кабмин."", ""Президент Турции объявил состав нового правительства. Перечислять не буду, на просторах сети новую команду Р.Т. Эрдогана найти несложно. Интереснее пройтись по отдельным личност..."", ""⚡️⚡️⚡️⚡️⚡️Святая София - это мечеть! Таково решение высшего суда Турции - Госсовета, который только что объявил об отмене решения кабмина Турции от 1934 года о смене статуса хра..."", ""Кабмин Турции под председательством Эрдогана обсудит в понедельник требование Украины закрыть проливы для российских военных кораблей, сообщает турецкое ТВ"", ""🇷🇺🇺🇦🇹🇷 Кабмин Турции под председательством Эрдогана обсудит в понедельник требование Украины закрыть проливы для российских военных кораблей, сообщает турецкое ТВ""]"
kabmin,kabmin_foreign:Нидерланды,5,"[""❗️Зеленский выпросил устаревшие натовские истребители. Президент Украины сообщил, что договорился главой кабмина Нидерландов о передаче Украине списываемых в утиль истребителей ..."", ""❗️В кабмине Нидерландов заявили, что «без дополнительных мер» уже нельзя гарантировать достаточное заполнение газохранилищ в Европе на зиму"", ""Совет Международной организации гражданской авиации (ИКАО) назвал Россию ответственной за крушение рейса MH17 на востоке Украины в 2014 году, в ближайшее время будет рассмотрен ..."", ""Горячий привет Зеленскому от голландского премьера. Глава кабмина Нидерландов Марк Рютте по телефону сказал украинскому лидеру, что хотя его страна не прекратит этим летом. пост..."", ""🇷🇺🇳🇱 Совет международной организации гражданской авиации (ИКАО) назвал Россию ответственной за крушение рейса MH17 на территории бывшей Украины в 2014-м, в ближайшее время будет...""]"
kabmin,kabmin_foreign:Финляндия,5,"[""❗️Глава кабмина Финляндии Санна Марин объявила о разводе с супругом Маркусом Ряйккененом. Она отметила, что они по-прежнему остаются лучшими друзьями и любящими родителями. Пара..."", ""❗️Тест на наркотики, который сдала премьер Финляндии Марин после скандального видео, оказался отрицательным кабмин Финляндии"", ""Стали известны имена Европейских лидеров, которые приедут на встречу с Трампом в Белый дом вместе с Зеленским Стали известны имена европейских лидеров, которые будут в понедельн..."", ""🇫🇮🇷🇺 Кабмин Финляндии продлил закрытие КПП на границе с Россией \""до дальнейшего уведомления\"""", ""🇫🇮🇷🇺 Кабмин Финляндии решил открыть два КПП на границе с Россией: Ваалимаа и Ниирала""]"
_c,c_foreign:Латвия,5,"[""Служба госбезопасности Латвии с прикарманенного телефона взломала Telegram-канал одного из главных русскоязычных авторов по военной тематике в надежде избавиться от пророссийски..."", ""Как сообщило издание «Postimees», с 8 декабря полностью прекращается вещание телеканала «Дождь» в Эстонии. В частности, об этом заявили в телекомпании «Elisa», одной из тех, что..."", ""Автор Telegram-канала @epoddubny специально для @rt_russian Люди, которые начали интересоваться и вникать в международную движуху только после возвращения Крыма в Россию, вряд л..."", ""Служба госбезопасности Латвии с прикарманенного телефона взломала Telegram-канал одного из главных русскоязычных авторов по военной тематике в надежде избавиться от пророссийски..."", ""🇷🇺 А пока все обсуждали события в Курской области многие пропустили интересную новость Оказывается RuTube очень мозолит глаза кому-то на западе. Таким образом видеохостинг забло...""]"
adm_prezidenta,ap_foreign:Тайвань,5,"[""⚡️Сайт администрации президента Тайваня подвергся кибератаке, сообщают тайванские СМИ."", ""⚡️Сайт администрации президента Тайваня подвергся кибератаке — Reuters."", ""На Тайване взволнованны. Во Внутренней Монголии китайцы воспроизвели городскую планировку правительственного квартала столицы сепаратистов – Тайбея. Тайваньские китайцы считают,..."", ""⚡️Сайт администрации президента Тайваня подвергся кибератаке — Reuters. На эмоциях запостил, подумав, что это сайт АП РФ. А это всего лишь Тайвань )::"", ""Четверо граждан Тайваня приговорены к длительный срокам тюремного заключения за шпионаж в пользу Китая. Трое из осужденных входили в состав службы безопасности Администрации пре...""]"
adm_prezidenta,ap_foreign:Сирия,4,"[""Итак, ситуация с группой Вагнер и в Сирии за последние пару дней развивается крайне стремительно. А обстановку не иначе, как захватывающе критической, я бы не назвал. Но перейде..."", ""Гинеколог из Воронежа возглавил администрацию президента Сирии Новым главой канцелярии Республиканского дворца в Дамаске станет младший брат главы движения ХТШ* в Сирии Махер Ху..."", ""Про Асада и сирийцев, которых призвали \""доверять официальным источникам\"" Последний пост на официальном канале администрации сбежавшего президента Сирии Башара Асада, 7 декабря: ..."", ""🇸🇾 Гинеколог из Воронежа занял руководящую должность среди террористов в Сирии. Махер Хусейн аль-Шараа, являющийся по совместительству братом Джуляни, отныне является главой адм...""]"
sovbez,sovbez_foreign:Ливан,4,"[""Иран расценивает взрывы пейджеров в Ливане как теракт, ответственность за него несет Израиль, сообщает иранское постпредство при ООН. Иран также оставляет за собой право принять..."", ""Израиль объявил войну международному правопорядку, пишет немецкий журнал Der Spiegel в своей редакционной статье. Сообщается, что Израиль уже несколько дней атакует танками миро..."", ""🇮🇱⚔️🇺🇳Израиль объявил войну международному правопорядку, атакуя войска ООН, - Der Spiegel ▪️Израиль уже несколько дней атакует танками миротворческую миссию ООН Unifil в Ливане,..."", ""⚡️Палестина – Израиль: что известно на 22:30 по мск⚡️ — США не готовы последовать призыву исламских стран, настаивающих на прекращении поставок оружия Израилю – Госдеп. — Спецбо...""]"
sovbez,sovbez_foreign:adj:грузинск,4,"[""Первый сожженный в Цхинвале грузинский танк. Секретарь совета безопасности ЮО генерал Баранкевич и ко поразил его метким выстрелом из РПГ-7. Потом будет много сгоревших грузинск..."", ""Первый сожженный в Цхинвале грузинский танк. Секретарь совета безопасности ЮО генерал Баранкевич и ко поразил его метким выстрелом из РПГ-7. Потом будет много сгоревших грузинск..."", ""Первый сожженный в Цхинвале грузинский танк. Секретарь совета безопасности ЮО генерал Баранкевич и ко поразил его метким выстрелом из РПГ-7. Потом будет много сгоревших грузинск..."", ""Первый сожженный в Цхинвале грузинский танк. Секретарь совета безопасности ЮО генерал Баранкевич и ко поразил его метким выстрелом из РПГ-7. Потом будет много сгоревших грузинск...""]"
sovbez,sovbez_foreign:Швейцария,4,"[""Заседание СБ ООН по ситуации на Украине запланировано на 30 октября, передает ТАСС со ссылкой на постпредство Швейцарии, являющейся председателем Совбеза в этом месяце."", ""Швейцария не будет разрешать реэкспорт своего оружия Украине, пока парламент не примет соответствующего решения. Об этом заявила постпред страны в ООН Паскаль Кристина Берисвиль..."", ""Армению на «саммите мира» в Швейцарии представит Секретарь Совета безопасности Армен Григорян. Странно, что не лично сам Никол Воваевич Пашинян. Чего уж стесняться и робеть? Теп..."", ""#Подборка #новостей #СМИ на утро 28 октября 2024г 🔴Российские вооруженные силы признаны сильнейшими в мире, следует из рейтинга журнала US News and World Report. По оценке журна...""]"
adm_prezidenta,ap_foreign:Афганистан,4,"[""❗️ В Палате представителей США подготовили 350-страничный отчет о выводе американских военных из Афганистана. «Администрация президента Джо Байдена вводила в заблуждение, а в не..."", ""Делегация во главе с командующим силами \""Талибана\"" (движение запрещено как террористическое) Абдулом Гани Барадаром возглавит администрацию президента Афганистана, заявил источн..."", ""Делегация во главе с командующим силами \""Талибана\"" Абдулом Гани Барадаром возглавит администрацию президента Афганистана. Управление страной передано совету, куда вошли глава вы..."", ""❗🇦🇫 Администрация президента Афганистана заявила, что ситуация в Кабуле находится под контролем, город не подвергался нападению. \""Талибан\"" отдал распоряжение своим боевикам не в...""]"
sovbez,sovbez_foreign:adj:польск,4,"[""❗️Заместитель председателя Совбеза России Дмитрий Медведев: Польский аналог странного диковинного существа по имени Блинкен, с гораздо более звучной фамилией Сикорский, судя по ..."", ""Зампред Совбеза РФ Медведев: «Польская мразь по имени «дуда» предложила пристрелить Россию, как бешеного зверя. И кто-то ещё надеется на переговоры с такими ублюдками? Нет смысл..."", ""❗️Опасности повторения ракетного обстрела нет — польский президент по итогам Совбеза Напомним, что ранее Анджей Дуда назвал инцидент с ракетами «единичным случаем», который не д..."", ""❗️Президент Польши Анджей Дуда решил созвать совет НАТО 16 ноября — СМИ Кроме того, на завтрашний день, сообщает канцелярия польского лидера, назначен Совет национальной безопас...""]"
sovbez,sovbez_foreign:Словакия,4,"[""Daily Mail: страны НАТО и ЕС «рассматривают возможность отправки войск на Украину», утверждает премьер-министр Словакии Роберт Фицо. В публикации отмечается, что «словацкий лиде..."", ""#новости Другие события сегодня: – Фицо созвал экстренное заседание Совбеза Словакии 23 января в связи с угрозой свержения правительства \""иностранными экспертами\"" – Dennik N – Т..."", ""В Словакии действует группа иностранных экспертов, которые готовят антиправительственные протесты аналогичные грузинским, - премьер Словакии Фицо. На 23 января созвано экстренно..."", ""Фицо созвал экстренное заседание Совбеза Словакии 23 января в связи с угрозой свержения правительства \""экспертами\"" из-за рубежа, сообщает портал Dennik N.""]"
kabmin,kabmin_foreign:Иордания,4,"[""⚡️⚡️⚡️⚡️ Атака, в которой погибли трое американских военных, совершена на военную базу США эт-Танф в Сирии, не на иорданской территории Официальный представитель кабмина Иордании"", ""Атака, в которой погибли трое американских военных, совершена на военную базу США эт-Танф в Сирии, а не на иорданской территории, — представитель кабмина Иордании"", ""🇺🇸☠️⚰️ 3 военных США убиты, 34 ранены от атаки дрона на американскую военную базу, — CNN ▪️Проиранские силы продолжают мстить американцам за поддержку операции Израиля в Газе, а..."", ""‼️🇯🇴🇺🇸🇸🇾Убившая военных США атака совершена на военную базу США эт-Танф на границе Сирии а не на иорданской территории — официальный представитель кабмина Иордании В Центральном...""]"
_c,c_foreign:Германия,4,"[""​​Важная новость, но начну издалека ⬇️ ⚡️Немецкий Христианско-демократический союз определился с датой съезда, который несколько раз переносился с весны из-за пандемии. На нем п..."", ""Роман Антоновский, писатель, публицист, автор Telegram-канала «Сыны Монархии» @SonOfMonarchy Большое обсуждение в России вызвал законопроект о запрете пропаганды нетрадиционных ..."", ""Камрады, ахтунг! Папочка готов порадовать вас новым форматом: встречайте зажигательный дуэт Папочки и Голоса Мордора в подкаст-рубрике «Эхо Мордора». В первом выпуске мы обсудим..."", ""А у нас получились песни именно про человека на войне, без всякого нытья. Особенно, конечно, у Фатьянова. Фатьянов - гений. Причем не из совписов. Абсолютный самородок, типа Рас...""]"
