trigger,guard,count,examples
prezident,country:Мозамбик,13,"[""Африка будет поставлять газ Украине: сегодня мы обсудили такие возможности с президентом Мозамбика, — Зеленский."", ""Я так понимаю, доя большего драйва и под выступление в ООН Шефир должен был быть трупом. И тогда со слезой «Утром был расстрелян мой друг, самый близкий друг…» Вообще всему миру..."", ""Кто из лидеров африканских стран уже находится в Сочи: • Президент Гвинеи Альфа Конде • Президент Мозамбика Филипе Ньюси • Президент Нигерии Мухаммаду Бухари • Президент ЮАР Сир..."", ""На форум Россия-Африка в Сочи уже прибыли: • Президент Гвинеи Альфа Конде • Президент Мозамбика Филипе Ньюси • Президент Нигерии Мухаммаду Бухари • Президент ЮАР Сирил Рамафоса ..."", ""❗️Мозамбик поставил на экспорт первую в своей истории партию сжиженного газа Первая в истории Мозамбика партия сжиженного газа с гигантского месторождения на шельфе страны в Инд..."", ""Москва. 31 мая. INTERFAX.RU - Россия могла быстро завершить специальную военную операцию на Украине, но не стала жертвовать мирным населением, заявила спикер Совета Федерации Ва..."", ""🇹🇿🇺🇬🇫🇷 Французы пытаются отстоять экономические интересы в Восточной Африке, но США с этим не согласны Французское СМИ Africa Intelligence сообщает, что генеральный директор Tot..."", ""🇲🇿 О выборах в Мозамбике 9 октября в Мозамбике прошли всеобщие выборы. По предварительным результатам победа досталась правящей с 1975 года партией ФРЕЛИМО. Кандидатом от неё ст...""]"
prezident,country:Бенин,13,"[""Если это реальный текст, то сильно: \""ЛионельЗинсу экс президент Бенина «Сейчас мы все только и слышим про этот кризис, антирусские санкции, нефть, газ….. А вы понимаете, что это..."", ""📋 Сводка значимых военно-политических событий за 31 марта Азия ▪️ В Афганистане проходят боестолкновения под Кайсаром и в Фарьябе, в Балхе взорван СВУ. На границе с Туркменистан..."", ""Президент Бенина Патрис Талон объявил о возвращении порядка в стране после попытки госпереворота. \""В ответ на эту ситуацию вооружённые силы Бенина и их командование, верные свое..."", ""📋 Сводка значимых военно-политических событий за 31 марта Азия ▪️ В Афганистане проходят боестолкновения под Кайсаром и в Фарьябе, в Балхе взорван СВУ. На границе с Туркменистан..."", ""​🇧🇯 \""Мы не можем позволить себе сидеть дома\"", или почему президент Бенина не верит в самоизоляцию Коронавирус гуляет по Африке — заражены уже 47 из 54 стран. Особенно болезненны..."", ""📝Главное от Рыбаря📝 дайджест материалов за 13 апреля В понедельник все обсуждали выборы в Венгрии, поражение Орбана и победу проевропейской оппозиции. Вчера все обещали резкий а..."", ""📝Главное от Рыбаря📝 дайджест материалов за 13 апреля В понедельник все обсуждали выборы в Венгрии, поражение Орбана и победу проевропейской оппозиции. Вчера все обещали резкий а..."", ""🇳🇪🎞 Попытка переворота в Нигере Обстановка к исходу дня 26 июля 2023 года В столице Нигера Ниамей сохраняется напряженная ситуация в связи с продолжающимся в стране военным пере...""]"
prezident,country:Уругвай,13,"[""📋 Сводка значимых военно-политических событий за 2 марта ▪️ В Сирии Сирийская Арабская Армия вернула Саракиб. Туда введены подразделения российской военной полиции. ▪️ НАТО прод..."", ""🇧🇷🇻🇪🇺🇾🇨🇱На Саммите лидеров стран Южной Америки, судя по всему, веселее, чем порой на границе с Техасом. Чего стоит только появление там Николаса Мадуро в декорациях из речей бра..."", ""🇺🇾🇺🇸🇦🇲На Саммит Америк также не приехал президент Уругвая Луис Лакалье Поу. Этот товарищ никаких бойкотов сборищу не объявлял, а сослался на внезапный коронавирус. С одной сторо..."", ""​​🇦🇷🇧🇷🇺🇾🇵🇾 Президент Аргентины назвал Бразилию «угрозой» для всей Южной Америки из-за распространения коронавируса Президент Аргентины Альберто Фернандес заявил в интервью радио..."", ""📋 Сводка значимых военно-политических событий за 2 марта ▪️ В Сирии Сирийская Арабская Армия вернула Саракиб. Туда введены подразделения российской военной полиции. ▪️ НАТО прод..."", ""​​🇺🇾 Новый президент Уругвая вступил в должность и рассказал приоритетах своего правительства Новый президент Уругвая Лакалье По накануне вступил в должность. Таким образом, пре..."", ""​​🇺🇾 Новый президент Уругвая вступил в должность и рассказал приоритетах своего правительства Новый президент Уругвая Лакалье По накануне вступил в должность. Таким образом, пре..."", ""​​🇺🇾 Новый президент Уругвая вступил в должность и рассказал приоритетах своего правительства Новый президент Уругвая Лакалье По накануне вступил в должность. Таким образом, пре...""]"
prezident,country:Греция,13,"[""👉 Список лидеров, министров иностранных дел государств, преимущественно стран Запада, а также руководителей международных организаций, посетивших Бучу. То самое место, где была ..."", ""❗️Утром сообщила полиция, что перекрывается движение в Кишиневе. Затруднение в дорожном движении. Уже позже выяснилось, что прилетает такая важная фигура, как президент Греции. ..."", ""«Благодарю за теплый прием в Афинах. Счастья и благополучия всем гражданам Греческой Республики», - Михаил Мишустин прибыл на торжественный обед к Президенту Греции и оставил св..."", ""Церемония зажжения олимпийского огня Игр 2020 сегодня проходит без публики из-за корона вируса. В предыдущие годы на мероприятие приезжали несколько тысяч зрителей. В этот раз з..."", ""Зеленский: Украина компенсирует потери газа от российских ударов импортом из Греции Президент Украины Владимир Зеленский сообщил, что Украина будет компенсировать потерю добычи ..."", ""Президент Греции Екатерина Сакелларопулу и министр обороны Никос Панайотопулос прибыли с визитом в Киев. Об этом сообщает греческое издание Skai. У них запланированы встречи с п..."", ""В Греции зажгли огонь зимних Олимпийских игр 2022 в Пекине Мероприятие проходит на античном стадионе в Древней Олимпии в присутствии президента Греции Катерины Сакелларопулу, пр..."", ""МИД Греции запретил приглашать представителей России на празднование Дня независимости, - министр иностранных дел Греции Гиоргос Герапетритис Свою независимость от Османов греки...""]"
prezident,country:Танзания,13,"[""Не веривший в коронавирус президент Танзании Джон Магуфули умер от коронавируса."", ""Международный ФАН: материалы за день (12 апреля 2021 года) #Чтиво 🕸 В рамках проекта «Сети влияния» авторы Telegram-канала «Рыбарь» @rybar совместно с аналитиками международной ..."", ""​​Африку тоже «встряхнуло» от конфликта. На дипломатическом треке ожидается сдержанность в отношении РФ и нейтралитет (с осуждением выступили лишь Габон, Гана, Кения). Во всяком..."", ""​​🇹🇿 По ту сторону стадии отрицания. О переменах в антикоронавирусной политике Танзании Президент Танзании Джон Магуфули публично признал COVID-19 «проблемой» и распорядился вве..."", ""​​🇹🇿 Биоэкономический симбиоз. Почему Танзания одной из первых открыла международный туризм «Лично я равнодушен к животным. Не хотелось бы провести отпуск, наблюдая за крокодила..."", ""​​🇹🇿 «Коронавирус — не повод бездельничать», или будни тропической Беларуси Ночные захоронения покойников, задержки с публикацией статистики, выявление COVID-19 у папайи и козла..."", ""Президент Танзании решил проверить, насколько эффективны в стране тесты на COVID-19, и отправил в лабораторию образцы, взятые не только у людей, но и у животных с фруктами. Поло..."", ""Бунт? Президент Танзании Магуфули отказался от китайского займа в 10 миллиардов долларов США, который подписал его предшественник, ехидно заметив, что только пьяница мог согласи...""]"
prezident,country:Эритрея,11,"[""Недавно вскрылся один из малозаметных, но эффективных инструментов западного неоколониализма — зависимость стареющих автократов от европейской медицины. 80-летний президент Алжи..."", ""❗️Путин завтра проведет переговоры с президентом Эритреи, который находится в России, обсудят перспективы развития двусторонних отношений. Кремль"", ""🇪🇹 Что происходит в Эфиопии? Обстановка с начала февраля 2023 года Правительство Эфиопии продолжает процесс деэскалации конфликта в северном регионе Тыграй. Национальные силы об..."", ""​​🇪🇹 За красной чертой. Основные события эфиопского конфликта на 7.11.2020 📍Война уже официально. 5 ноября замначштаба ВС Эфиопии генерал Берхану Джула подтвердил прессе, что ст..."", ""🇺🇦Ответственность за события, происходящие на территории Украины, лежит на странах коллективного Запада — Президент Эритреи CША долгие годы настраивали весь мир против России. В..."", ""​🇪🇷🇪🇹 Первая русско-украинская Сегодня премьер Эфиопии Абий Ахмед получил Нобелевскую премию мира за урегулирование пограничного конфликта с Эритреей. Это была последняя классич..."", ""📝Напряженность между Эфиопией и Эритреей📝 Обстановка на 2 августа 2025 года Последние несколько лет конфликт между руководством Эфиопии и Эритреи оставался в политической плоско..."", ""🌍🇨🇳 О китайско-африканском форуме Пока в Пекине только начинается восьмой «Форум сотрудничества Китай-Африка» говорить о каких-то итогах может показаться, что рано. Но на деле в...""]"
prezident,country:Дания,11,"[""Я просто цитирую укросми, и уже становится смешно: «Мы не начали контрнаступление раньше, потому что было нечем», - Зеленский «У нас был дефицит танков. Могли погибнуть тысячи ч..."", ""🖥️ Сюжет Berliner Zeitung: Экзистенциальный кризис в военном альянсе — Трамп угрожает выходом из НАТО. Дональд Трамп больше не ставит под сомнение вывод США из НАТО. Это связано..."", ""WSJ: «Трамп хочет повторить идею Трумэна, предлагавшего купить у Дании Гренландию. Президент уже обсудил эту идею с советниками и попросил изучить возможность сделки» Таким обра..."", ""Интересное за сегодня: – США возобновят поставки Израилю авиабомб, приостановленные в апреле – Axios – Армения получила приглашение принять участие в мероприятии партнерского фо..."", ""Зеленский вместе с Первой леди прибыли в парламент Дании. Президент произнесет речь перед датскими парламентариями."", ""Геннадий Гудков пытается в Шендеровича. Но Витя хоть умный, а вот у Геннадия с этим не очень, поэтому получается какая-то дикая стыдная нелепица. Уж лучше бы что-нибудь про през..."", ""⚡️🇷🇺 ДАТСКИЕ Т-72 и БМП для УКРАИНЫ за СОТНИ миллионов ЕВРО! - Откуда у Дании Т-72? - Президент Словакии унизил Украину! - Илон Маск угарает над помощью ВСУ! - КЕМ сейчас заняты..."", ""«У нас теперь есть ATACMS, и мы будем их использовать» — Зеленский подтвердил разрешение на дальнобойные удары по «старой» России На пресс-конференции с премьер-министром Дании ...""]"
prezident,country:Ангола,11,"[""Скончался бывший президент Анголы Жозе Эдуарду душ Сантуш. Мне довелось знать его лично. Он был искренним другом нашей страны, внес огромный вклад в развитие отношений между Рос..."", ""❗️Байден сидит и ухмыляется прессе, игнорируя их вопросы после встречи с президентом Анголы."", ""Кто из лидеров африканских стран уже находится в Сочи: • Президент Гвинеи Альфа Конде • Президент Мозамбика Филипе Ньюси • Президент Нигерии Мухаммаду Бухари • Президент ЮАР Сир..."", ""На форум Россия-Африка в Сочи уже прибыли: • Президент Гвинеи Альфа Конде • Президент Мозамбика Филипе Ньюси • Президент Нигерии Мухаммаду Бухари • Президент ЮАР Сирил Рамафоса ..."", ""Президенту США Джо Байдену опять потребовалась помощь в преодолении ступенек. На этот раз услугу ему оказал президент Анголы Жуан Лоренсу. Байден сейчас находится в своей первой..."", ""Для Байдена и его администрации происходящее в Южной Корее явно стало сюрпризом. Находящийся с визитом в Анголе президент США не смог внятно прокомментировать ситуация с стране,..."", ""​Представители Военной академии Генерального штаба ВС РФ и вооруженных сил Анголы, а также Высшей военной школы генштаба республики обсудили вопросы расширения сотрудничества в ..."", ""🇦🇴🇺🇸 О визите Байдена в Анголу и «саммите коридора Лобиту» Еще с конца сентября было известно, что президент США Джо Байден сделает поездку в Анголу одним из финальных визитов в...""]"
prezident,country:Малави,11,"[""\""Самый страшный телохранитель в мире\"" был замечен на церемонии приведения к присяге президента Малави 29-е мая 2019-го года"", ""Кто из лидеров африканских стран уже находится в Сочи: • Президент Гвинеи Альфа Конде • Президент Мозамбика Филипе Ньюси • Президент Нигерии Мухаммаду Бухари • Президент ЮАР Сир..."", ""​​🇲🇼 После обнуления. За кулисами «образцовой африканской демократии» Жители Малави — с недавних пор «образцовой демократии Африки» — вновь вышли к урнам после того, как Констит..."", ""На форум Россия-Африка в Сочи уже прибыли: • Президент Гвинеи Альфа Конде • Президент Мозамбика Филипе Ньюси • Президент Нигерии Мухаммаду Бухари • Президент ЮАР Сирил Рамафоса ..."", ""\""Самый страшный телохранитель в мире\"" был замечен на церемонии приведения к присяге президента Малави 29-е мая 2019-го года"", ""Президент Малави отдал приказ военным готовиться к выводу своих войск из восточной части Демократической республики Конго. Бурунди направила дополнительно 2000 военнослужащих на..."", ""Кортеж президента Малави Питера Мутарики... на зависть Трампу. #Африка @nеw_militarycolumnist"", ""\""Самый страшный телохранитель в мире\"" был замечен на церемонии приведения к присяге президента Малави 29-е мая 2019-го года""]"
