trigger,guard,count,examples
prezident,country:Киргизия,217,"[""От итогов выборов президента США будет зависеть внешняя политика ЕС, в том числе в отношении Украины. Об этом заявил Виктор Орбан на встрече с президентом Киргизии: «Во всех кру..."", ""🌍 Президент Киргизии заявил, что не потерпит указов Запада Западные страны не должны вмешиваться в отношения Бишкека с Москвой и СНГ. Об этом заявил президент Киргизии Садыр Жап..."", ""🌍 Президент Киргизии заявил, что не потерпит указов Запада Западные страны не должны вмешиваться в отношения Бишкека с Москвой и СНГ. Об этом заявил президент Киргизии Садыр Жап..."", ""🇷🇺 КТО ПОСЕТИТ ПАРАД ПОБЕДЫ 9 МАЯ 2025. Какие страны точно будут присутствовать на мероприятии, посвященном 80-й годовщине окончания Великой Отечественной войны. Полный список: ..."", ""Беспорядки в Киргизии. Главное к утру: — во время акций протеста в Киргизии пострадали 590 человек, один погиб; — в здании парламента произошёл пожар. Ночью здание захватили уча..."", ""Беспорядки в Киргизии. Главное к утру: — во время акций протеста в Киргизии пострадали 590 человек, один погиб; — в здании парламента произошёл пожар. Ночью здание захватили уча..."", ""После возвращения из Москвы президент Киргизии Сооронбай Жээнбеков, члены правительственной делегации и сопровождавшие их лица сдали повторный тест на коронавирус. Результаты ан..."", ""Президент Киргизии Сооронбай Жээнбеков по приглашению российской стороны приедет в Москву на парад в честь 75-летия Победы в Великой Отечественной войне, намеченный на 24 июня.""]"
prezident,country:Хорватия,214,"[""✔️Вашингтонский обком находится в активном поиске нового генсека НАТО и продолжает соответствующие смотрины. Кого уже только не собеседовали на место, которое пока что греет Сто..."", ""✔️«- Продлевать будете? - Думаем, с тебя достаточно» Примерно из такого диалога Йенс Столтенберг узнал, что его мандат на осуществление полномочий генерального секретаря НАТО за..."", ""Президент Хорватии Зоран Миланович катком проехался по теме конфликта на Украине и отношений России с Западом: - Россию провоцировали на начало боевых действий с 2014 года - Зап..."", ""Финский президент Александр Стубб снова взялся за старое. «На полях» форума в Давосе он дал интервью журналистам Bloomberg, в котором заявил следующее: «Министр иностранных дел ..."", ""Действующий президент Хорватии Зоран Миланович победил на президентских выборах. Он набрал 74,66% голосов избирателей по итогам второго тура. Об этом сообщает Государственная из..."", ""Действующий президент Хорватии Зоран Миланович со значительным отрывом лидирует по итогам второго тура выборов главы государства, свидетельствуют результаты экзитпола."", ""Действующий президент Хорватии Зоран Миланович набрал 51,48% голосов на выборах, сообщает радио и телевидение страны по результатам exit poll. Второе место занял Драган Приморац..."", ""❗️ Президент Хорватии заявил, что не допустит отправки своих солдат на Украину. «Пока я президент Хорватии, я не подпишу [документ], чтобы хорватские солдаты присутствовали на У...""]"
prezident,country:Узбекистан,210,"[""Власти Узбекистана оплатили депортацию собственных мигрантов из США Чтобы задобрить Трампа, Узбекистан полностью профинансировал депортацию своих граждан, а также граждан Киргиз..."", ""🔥 Германия ожидает прибытия квалицированных мигрантов из Узбекистана — Bloomberg. Президент республики Шавкат Мирзиёев и канцлер ФРГ Олаф Шольц подписали документы о сотрудничес..."", ""🇷🇺 КТО ПОСЕТИТ ПАРАД ПОБЕДЫ 9 МАЯ 2025. Какие страны точно будут присутствовать на мероприятии, посвященном 80-й годовщине окончания Великой Отечественной войны. Полный список: ..."", ""В 1984 году сформирован прославленный в боях 682-й Уманско-Варшавский Краснознаменный ордена Кутузова мотострелковый полк. 👍 В марте 1984 года из Афганистана в город Термез Узбе..."", ""‘Я еще раз посмотрел мощь России’ – президент Узбекистана Мирзиёев о Параде Победы."", ""Сформирован 682 мсп в 1984 682 Уманско-Варшавский Краснознаменный ордена Кутузова мотострелковый полк В марте 1984 года из Афганистана в город Термез Узбекской ССР был выведен д..."", ""🇺🇿В Москве у посольства Узбекистана сегодня была огромная очередь Граждане этой страны пришли на избирательный участок в посольстве. Сегодня в Узбекистане выбирают президента."", ""Слова Лукашенко о том, что \""Узбекистан может быть следующим\"", а потому Ташкенту лучше бы вернуться в ОДКБ, вызвали бурную реакцию, а негатив в УзНете агрегировало издание, предп...""]"
prezident,country:Германия,209,"[""Недавно вскрылся один из малозаметных, но эффективных инструментов западного неоколониализма — зависимость стареющих автократов от европейской медицины. 80-летний президент Алжи..."", ""Президент Германии Штайнмайер — назвал главными угрозами для немцев Россию и ультраправых: Ещё никогда в истории нашего объединённого государства демократия и свобода не подверг..."", ""Творческий коллектив выступает в церкви на разогреве у президента Германии Франка-Вальтера Штайнмайера."", ""В годовщину начала Второй мировой войны президент Польши выступил с заявлением и потребовал от Германии выплатить репарации. Об этом сообщил портал RMF24. Навроцкий подчеркнул, ..."", ""🇩🇪 Президент Германии распустил Бундестаг Президент ФРГ Франк-Вальтер Штайнмайер объявил о намерении распустить Бундестаг после того, как тот отказал в доверии правительству кан..."", ""😄Трампу приготовится – в 404 обсуждается кандидатура на должность посла в США. Как сообщил председатель правления Института мировой политики Виктор Шлинчак, новым послом «незале..."", ""🔥 Раскол в правительстве ФРГ. Президент Германии пытается продавить военную помощь Киеву несмотря на блокировку Минфина. Лидер ФРГ Франк-Вальтер Штайнмайер во время визита в вен..."", ""🇩🇪🇹🇷 Президента Германии встретили протестами в Турции Президент Франк-Вальтер Штайнмайер во время делового визита в Анкару посетил провинцию Газиантеп, которая 6 февраля постра...""]"
prezident,country:Мексика,201,"[""Трамп намекнул, что вслед за Венесуэлой он может заняться Мексикой «Президент Мексики хорошая женщина, но она не управляет страной. Мексикой управляют картели. Нам придётся что-..."", ""Трамп встретится с Зеленским на полях саммита G7 в Канаде Президент США Дональд Трамп на полях саммита G7 в Канаде намерен провести двусторонние встречи с главой киевского режим..."", ""Трамп потребовал от президента Мексики допустить американских военных на территорию Мексики для проведения антитеррористической операции против наркокартелей Напомним, что Трамп..."", ""🔥 NBC News: Мексика отказалась принять депортационный рейс США. В пятницу вечером американский военный самолет перевозил в Мексику незаконных мигрантов, но власти страны отказал..."", ""🔥 Переименование Мексиканского залива коснется только США, заявила президент Мексики. Президент США Дональд Трамп говорит, что собирается назвать континентальный шельф заливом А..."", ""🔥 Переименование Мексиканского залива коснется только США, заявила президент Мексики. Президент США Дональд Трамп говорит, что собирается назвать континентальный шельф заливом А..."", ""🔥 Николас Мадуро готов освободить от США Пуэрто-Рико. Для этого президент Венесуэлы хочет применить свои и даже бразильские войска. Ну или, по крайней мере, этим угрожает. У Сев..."", ""🌍 Избранный президент Мексики отказалась посетить Украину по приглашению Зеленского ✔️ Клаудия Шейнбаум отметила, что намерена поехать на некоторые международные события, но пут...""]"
prezident,country:Молдова,194,"[""⚡️⚡️⚡️#Инсайд Наш источник в ОП рассказал, что Офис Президента передал MI-6 планы Украинского Генштаба по военной операции против Приднестровья. Британия должна продавить Презид..."", ""⚡️Санду сдала страну. Официально. Президент Молдовы публично заявляет, что проголосовала бы за присоединение к Румынии. Не за союз, не за партнерство — за поглощение. Под соусом..."", ""⚡️Санду сдала страну. Официально. Президент Молдовы публично заявляет, что проголосовала бы за присоединение к Румынии. Не за союз, не за партнерство — за поглощение. Под соусом..."", ""⚡️Санду обвинила Грузию в колонизации Россией. Президент Молдовы Майя Санду вновь выступила с резкими заявлениями, на этот раз обвинив Грузию в том, что она стала «колонией Росс..."", ""Санду заявила, что Молдова нуждается в экономической помощи Евросоюза, чтобы сохранить проевропейский курс в 2024 году. \""Сложно добиться поддержки демократии, когда экономическа..."", ""Президент Республики Молдова Майя Санду: Российская Федерация основная угроза для молдавского государства. Россия использует коррумпированных политиков в Молдове для продвижения..."", ""Из жизни насекомых: Президент Молдовы Майя Санду отправит группу полицейских для помощи расследования в покушении на Дональда Трампа."", ""✔️«Я тот человек, к которому они обращаются, когда хотят кого-то обвинить», - заявил о себе родившийся в Венгрии, переживший холокост и работающий на США миллиардер еврейского п...""]"
prezident,country:Эстония,189,"[""Президент Эстонии Карис признал необходимость выстраивать дипотношения с Россией После окончания боевых действий на территории Украины Эстонии придется восстанавливать дипломати..."", ""Президент Эстонии Карис признал необходимость выстраивать дипотношения с Россией После окончания боевых действий на территории Украины Эстонии придется восстанавливать дипломати..."", ""🇪🇪 Президент Банка Эстонии пожаловался на постоянный дефицит государственного бюджета 📝 По словам Мадиса Мюллера, в следующем году расходы страны достигнут 18,5 млрд евро. При э..."", ""🇪🇪 Президент Эстонии заявил о необходимости «поставить Россию на колени» Эстония сделает все возможное для этого, заявил Алар Карис. 📝 «Тогда могут начаться серьезные переговоры..."", ""🇪🇪 Президент Эстонии заявил о необходимости «поставить Россию на колени» Эстония сделает все возможное для этого, заявил Алар Карис. 📝 «Тогда могут начаться серьезные переговоры..."", ""Эстония предоставит Украине долгосрочный пакет помощи на сумму в €1,2 млрд, — президент Эстонии Алар Карси на пресс-конференции с Зеленским Также он заявил, что Эстония выступае..."", ""🇪🇪🇺🇦 Президент Эстонии: \""Эстония против ограничений на удары по России оружием, которое дают Украине западные партнеры\"" Ну от проебалтов я другого и не ожидал, если честно. Эти ..."", ""Эстония выступает за то, чтобы разрешить ВСУ наносить удары по России западным оружием — президент Эстонии Алар Карси на пресс-конференции с Гнидой. По лезвию прошёлся.""]"
prezident,country:Таджикистан,174,"[""Президент Таджикистана продемонстрировал самый точный гол в истории мировой политики. Точным ударом президент Таджикистана Эмомали Рахмон забил гол на открытии местного манежа, ..."", ""Президент Таджикистана продемонстрировал самый точный гол в истории мировой политики. Точным ударом президент Таджикистана Эмомали Рахмон забил гол на открытии местного манежа, ..."", ""🔥 Еще один национальный лидер подтвердил визит в Москву 9 мая. Президент Палестины Махмуд Аббас примет участие в мероприятиях по случаю Дня Победы в Москве. Аббас стал уже как м..."", ""В наступлении террористических организаций на Алеппо - крупнейший город Сирийской Арабской Республики - активное участие принимают среднеазиатские \""добровольцы\"". Интернет-простр..."", ""🇷🇺 КТО ПОСЕТИТ ПАРАД ПОБЕДЫ 9 МАЯ 2025. Какие страны точно будут присутствовать на мероприятии, посвященном 80-й годовщине окончания Великой Отечественной войны. Полный список: ..."", ""Эмомали Рахмон – иноагент? В Душанбе стартовал саммит Россия - Центральная Азия. Уже завтра, 3 марта намечены расширенные переговоры делегаций Таджикистана и России. Чего можно ..."", ""О выступлении Эмомали Рахмона на саммите «Россия — Центральная Азия» 1. Эмомали Рахмон, президент Таджикистана и в соответствии с Конституцией РТ «Основатель мира и национальног..."", ""Президент Таджикистана Рахмон, сделал сегодня вполне разумную вещь. В Таджикистане призвано 20 000 резервистов и их отправят на таджико - афганскую границ. Понятно, что частично...""]"
putin,hashtag_only,171,"[""Об этом я говорил в одной из своей книг \""Коучинг война\"". Скачать бесплатно можно на нашем сайте, как я ряд других изданий. #путин #война @kyber_net"", ""#Путинвведивойска"", ""Сегодня в 21:00 по Москве 19:00 по Берлину #докторсосновский #стенасосновского #сосновский #габсбург #deutschland #trump #война #мерц #putin #зеленский #путин #трамп https://you..."", ""Утро в Гостином дворе. #Путин2024"", ""МОЛНИЯ ⚡️ Из Липецкой области пришло сообщение об остановке колоны Вагнера. Вероятно, начала действовать договоренность, достигнутая при посредничестве Александра Лукашенко #Ваг..."", ""Ситуация в Херсонской области на утро 09.11.2022. По всем направлениям Херсонской области, укровермахт попытался просочится, но был отбит нашими войсками. На Снегиревском направ..."", ""В Херсоне был задержан стрелок из гранатомёта по отделу полиции. Подозреваемый в нападении на Днепровское РОВД города Херсона задержан. Мужчина признался, что готовил нападение ..."", ""Кому мы сегодня противостоим на Херсонском направлении. Никому уже не секрет, что практически весь «цивилизованный» мир - это нынешний 4-й рейх уже открыто воюет против России. ...""]"
