trigger,guard,count,examples
prezident,country:Австрия,38,"[""🔥 Австрия не смогла бы дать военную помощь Киеву, даже если бы захотела. Президент Австрии Александер Ван дер Беллен заявил, что его страна физически не способна предоставить Ук..."", ""👉 Список лидеров, министров иностранных дел государств, преимущественно стран Запада, а также руководителей международных организаций, посетивших Бучу. То самое место, где была ..."", ""❗Собака президента Молдовы Майи Санду укусила за палец приехавшего в Кишинёв президента Австрии Александра Ван дер Бел."", ""❗️Западные политики один за другим хотят привлечь российского президента к суду в Гааге. По словам экс-кандидата в президенты Австрии Геральда Гросса, если бы в Гааге рассуждали..."", ""«Это шизофрения». На европейском телевидении разгорелся скандал на почве антироссийских санкций - кандидат в президенты Австрии Геральд Гросс заявил, что в Брюсселе не думают о ..."", ""Мария Захарова : Шокирует то, что Запад называет случай в воздушном пространстве Белоруссии «шокирующим». Жизнь «цивилизованных демократий» по траектории «quod licet Iovi, non l..."", ""Национал-куколдизм и толерантность головного мозга 80 левела. 2017 год: «В условиях роста исламофобии настанет день, когда нам придётся попросить ВСЕХ женщин носить платок в зна..."", ""Абсолютными виртуозами в замалчивании национальности являются, конечно, австрийцы. Так технично слить Гитлера, что все его считают немцем - это надо постараться. Все-таки австри...""]"
prezident,country:Организация Объединенных Наций,38,"[""В Тбилиси начинается массовая акция протеста оппозиции, которая отказалась признавать результаты парламентских выборов. Во время вчерашнего обращения к нации президент Грузии Са..."", ""Я собираюсь продолжать быть президентом, потому что сейчас военное положение. Я счастлив быть президентом такой нации и я считаю, что мы должны идти вместе до самого конца, — за..."", ""NY Post: «паранойя» главы Пентагона Хегсета привела к чистке генералов на фоне войны с Ираном Издание пишет, что в Вашингтоне разгорается внутренний конфликт в руководстве армии..."", ""Сенатор Линдси Грэм* заявил в Х, что Дональд Трамп планирует ввести крупные тарифы против Колумбии: «Сегодня состоялась очень хорошая беседа с президентом Трампом о его решимост..."", ""🖥️ Дональд Трамп о плане по урегулированию конфликта в секторе Газа: «В этом процессе задействовано много людей. Я также хочу поблагодарить премьер-министра Нетаньяху за согласи..."", ""«Мы хорошо знаем, что в глобальных процессах мы можем быть лишь фактором, соответствующим нашему весу, но все же та решимость, которую мы сообща показываем в вопросе урегулирова..."", ""🖥️ \""Я остаюсь вашим президентом. Легитимного парламента нет, поэтому нелегитимный парламент не может избрать нового президента. Поэтому не может быть никакой инаугурации. И мой ..."", ""🇺🇦Попытка вывезти семью в Испанию будет стоить Зеленскому президентского кресла. В Раде заявили, что если подлинность разговора, запись которого разошлась по телеграм-каналам по...""]"
prezident,country:Кения,38,"[""Из резиденции президента Кении вылетают вертолёты, предположительно, идёт эвакуация. Неудачно как-то американцы назначили Кению своим главным союзником."", ""Главное из заявлений Лаврова на пресс-конференции по итогам переговоров с главой МИД и президентом Кении: 📌РФ и Кения завершат создание межправокомиссии по торгово-экономическом..."", ""Главное из заявлений Лаврова на пресс-конференции по итогам переговоров с главой МИД и президентом Кении: 📌РФ и Кения завершат создание межправокомиссии по торгово-экономическом..."", ""❗️Сергей Лавров проводит пресс-конференцию по итогам переговоров с главой МИД и президентом Кении."", ""Президент Кении Ухуру Кениата так вдохновился рабочим визитом на Ямайку, что понемногу сам становится растаманом Jah love"", ""В Кении возобновились протесты против повышения налогов и экономической политики правительства. МИД РФ призывает граждан России избегать центральных районов столицы Кении. Прези..."", ""О массовых беспорядках в Кении С 20-го июня в Кении идут ежедневные протесты, на которых участвуют тысячи людей. Причиной для них послужило предложение правительства ввести допо..."", ""Международные наблюдатели приехавшие в Россию на выборы президента - Кения, Франция, США, Алжир.""]"
prezident,country:Монголия,36,"[""Опубликован список лидеров государтв, подтвердивших своё участие в Параде Победы 9 мая. На праздник также были приглашены премьер-министр Индии Нарендра Моди и президент Монголи..."", ""🖥️ В Москву для участия в торжествах по случаю Дня Победы прибыл президент Монголии Ухнаагийн Хурэлсух. Ранее в российскую столицу прибыли лидер Венесуэлы Николас Мадуро и кубин..."", ""Президент Монголии примет участие в мероприятиях в честь празднования 80-летия Победы в Москве. Об этом сообщило агентство Монцамэ."", ""📺📺 Главное за день 🟥Потери ВСУ на курском направлении за сутки составили до 400 военных и 12 бронемашин; 🟥Морпехи разнесли колонну боевой техники ВСУ в Курской области; 🟥Путин п..."", ""❗️ Отношения Улан-Батора и Москвы укрепились и достигли уровня всеобъемлющего стратегического партнерства, заявил президент Монголии."", ""📹На полях саммита ШОС проходит встреча главы Российского государства с Президентом Монголии Ухнагийн Хурэлсухом."", ""📹Александр Лукашенко провел переговоры с президентом Монголии в юрте в Улан-Баторе."", ""Переговоры главы российской делегации Сергея Лаврова с Президентом Монголии в Улан-Баторе""]"
prezident,country:Тунис,36,"[""Кайс Саид переизбран президентом Туниса на второй срок. Высшая независимая избирательная комиссия утвердила результаты выборов, которые состоялись 6 октября. Явка на голосовании..."", ""​​⚔️ ТУНИС: АРАБСКАЯ ЗИМА ⚔️ Почему Тунис лихорадит спустя 12 лет после победы «арабской весны» Часть первая. РЕВОЛЮЦИЯ ГОЛОДНЫХ В 2021 году на годовщину свержения президента Ту..."", ""​​⚔️ ТУНИС: АРАБСКАЯ ЗИМА ⚔️ Почему Тунис лихорадит спустя 12 лет после победы «арабской весны» Часть первая. РЕВОЛЮЦИЯ ГОЛОДНЫХ В 2021 году на годовщину свержения президента Ту..."", ""🇹🇳 Президент Туниса Каис Саид заморозил работу парламента, снял неприкосновенность со всех депутатов и отправил в отставку премьер-министра Хишама аль-Машиши. Накануне страну на..."", ""​​Новая статья Комиссара Яррика опубликована международной редакцией Федерального агентства новостей (ФАН) На годовщину свержения президента Туниса Зин аль-Абидина Бен Али стран..."", ""​​Новая статья Комиссара Яррика опубликована международной редакцией Федерального агентства новостей (ФАН) На годовщину свержения президента Туниса Зин аль-Абидина Бен Али стран..."", ""⚡️⚡️⚡️ Муфида Туати, политический журналист TAP, подтвердила смерть действующего президента Туниса Беджи Каида ас-Себси."", ""О развитии государственного переворота в Тунисе. 1. Президент страны отправил в отставку министра обороны Туниса. Подозревался в нелояльности. 2. В стране введен месячный коменд...""]"
prezident,country:Уганда,36,"[""Сын президента Уганды, бригадный генерал Мухоози Каинеругаба: Я слышал, что некоторые иностранные компании (я не знаю, какие именно) хотят покинуть страну, потому что мы приняли..."", ""Читаю «Коммерсант»: «Несколько дней подряд Сергей Лавров, отвечая на вопросы журналистов, раз за разом повторял, что российской вины в создании продовольственного кризиса, также..."", ""Павел Дуров уже открыто говорит, что в Facebook идут вбросы на тему российского происхождения ТГ. Американский Big Tech не потерпит конкуренции, они сильны именно монополией на ..."", ""Президент Уганды принял иранского посла Маджида Сафара в Кянкуанзи для обсуждения вопросов общего интереса и сотрудничества между двумя странами."", ""Кто из лидеров африканских стран уже находится в Сочи: • Президент Гвинеи Альфа Конде • Президент Мозамбика Филипе Ньюси • Президент Нигерии Мухаммаду Бухари • Президент ЮАР Сир..."", ""​​🇸🇴 «Политический СПИД». О новом кризисе в Сомали Новый и самый серьезный с апреля 2021 г. конституционный кризис разразился в Сомали после того, как 6 сентября премьер Мохамед..."", ""​​🇺🇬 «Остаться любой ценой». О президентских выборах в Уганде В 1971 г. один студент представил диссертацию об идеях Франца Фанона о насилии как высшей формы политической органи..."", ""​​Ревизия ревизоров. О скандале в Афросоюзе Влиятельный журнал «Жен Африк» вновь написал об одной из самых деликатных и болезненных для Африканского союза тем. В Механизме взаим...""]"
prezident,country:Мадагаскар,32,"[""Знаете, что это? Это знак того, что ЮАР скоро вспыхнет. Аналогичные изображения ранее в разное время появлялись перед протестами в Венесуэле, в будущем Южном Судане, обычном Суд..."", ""Reuters: Президент Мадагаскара Андри Радзуэлина, ранее покинувший страну на фоне массовых протестов, отправлен в отставку парламентом, который накануне он сам и распустил. Вслед..."", ""Africa Intelligence: Покинувший Мадагаскар президент отказался уходить в отставку на фоне массовых беспорядков. Андри Радзуэлина заявил, что способен управлять страной даже из-з..."", ""Reuters: Президент Мадагаскара покинул страну после протестов поколения Z, сообщают официальные лица. Президент Мадагаскара бежал из африканской страны, заявили в понедельник гл..."", ""Reuters: Президент Мадагаскара покинул страну после протестов поколения Z, сообщают официальные лица. Президент Мадагаскара бежал из африканской страны, заявили в понедельник гл..."", ""Международный ФАН: материалы за день (22 июля 2021 года) #Чтиво 🏴 В рамках проекта #Антитеррор Telegram-канал Рыбарь @rybar рассказал о тернистом пути ключевого русофоба в рядах..."", ""Что-то, воля ваша, суровое творится на африканском континенте. Пока наше внимание обращено на классические застарело кровоточащие регионы, вроде Афганистана – в Африке под шумок..."", ""Что-то, воля ваша, суровое творится на африканском континенте. Пока наше внимание обращено на классические застарело кровоточащие регионы, вроде Афганистана – в Африке под шумок...""]"
prezident,country:Вьетнам,31,"[""👔 Байден вдруг заявил, что спас мир от военной угрозы со стороны Вьетнама Американского президента спросили о его главном политическом наследии, и Байдену опять что-то причудило..."", ""Начало российско-вьетнамских переговоров. Темнейший пригласил Президента Вьетнама То Лама в Москву на празднование 80-летия Победы в Великой Отечественной войне."", ""Даже президент Вьетнама учился в Москве! А вы все до сих пор кафиры ! В сердце многих вьетнамцев и в моем сердце всегда хранится образ красивого пейзажа России, образ о русском ..."", ""Даже президент Вьетнама учился в Москве! А вы все до сих пор кафиры ! В сердце многих вьетнамцев и в моем сердце всегда хранится образ красивого пейзажа России, образ о русском ..."", ""🇷🇺🇻🇳«На полях» мероприятия ООН состоялась встреча Генпрокурора России с Президентом Вьетнама. Уважаемый товарищ Президент! Убежден, что взаимодействие надзорных ведомств Вьетнам..."", ""🇷🇺🇻🇳В рамках официального визита делегации Росгвардии в Ханой состоялась встреча главы ведомства Героя России генерала армии Виктора Золотова с Генеральным секретарем Центрально..."", ""Армия Россия освободила Украинку в ДНР. Это усиливает фланги группировки «Отважных». До границы с Днепропетровской областью всего 13 километров. И другие итоги дня: 🟥Армия Росси..."", ""🖥️ В столице Вьетнама, в Ханое начались российско-вьетнамские переговоры с участием премьер-министра России Михаила Мишустина и премьера Вьетнама Фам Минь Тиня. Главное: 🟥Глава ...""]"
prezident,country:Зимбабве,30,"[""🌍Африка с нами! Рассуждая о занятой африканскими странами позиции в связи с украинским кризисом, британское издание The Guardian признает, что поддержка со стороны многих африка..."", ""'Ресурсы Африки должны принадлежать Африке', — сказал бывший президент Зимбабве. А мы напомнили. Такая вот у RT реклама в Африке. За фото спасибо экс-министру образования страны..."", ""🖥️ Президент Зимбабве Эммерсон Мнангагва прибыл в Москву для участия в праздничных мероприятиях по случаю Дня Победы."", ""❗️ Вертолёт, на котором должен был лететь президент Зимбабве Эммерсон Мнангагва потерпел крушение. Местный телеканал со ссылкой на заявление министра информации страны Дженфана ..."", ""❗️Африка перестала быть спящим гигантом, она поднимается и скоро \""зарычит, как лев\"" — президент Зимбабве Эммерсон Мнангагва в интервью ТАСС."", ""❗️Зимбабве заинтересовано в прямом авиасообщении с Россией, хочет изучить возможность его запуска. Президент Зимбабве Эммерсон Мнангагва"", ""❗️Путин после пленарки ПМЭФ попрощался с президентом Боливии и беседует с президентом Зимбабве. Дмитрий Песков"", ""❗️Продвижение многополярного мира имеет большой потенциал для Зимбабве и Африки в целом. Президент Зимбабве на пленарном заседании ПМЭФ""]"
prezident,country:Ирландия,30,"[""🖥️ Бывший чемпион UFC в легком и полулегком весе Конор Макгрегор объявил об участии в президентских выборах Ирландии. Он сообщил, что ему удалось собрать необходимые подписи для..."", ""🖥️ Бывший чемпион UFC в легком и полулегком весе Конор Макгрегор объявил об участии в президентских выборах Ирландии. Он сообщил, что ему удалось собрать необходимые подписи для..."", ""Навязчивый клоун: Зеленский* за сутки обзвонил семерых европейских лидеров и попросил у них деньги на карманные расходы поблагодарил их за поддержку. Массовые спам-звонки он про..."", ""❗️Экс-чемпион UFC Конор Макгрегор допустил, что будет баллотироваться на пост президента Ирландии. Выборы пройдут в 2025 году. Макгрегору 35 лет, он владел чемпионскими поясами ..."", ""❗️Джо Байден встречается с президентом Ирландии Майклом Хиггинсом в Дублине."", ""Джо Байден не узнал Риши Сунака во время визита в Ирландию. Президент США буквально отодвинул премьер-министра Великобритании, чтобы поздороваться с представителем короля в граф..."", ""Новый кандидат в президенты Ирландии. 😀😀😀 Заявление на удаленное голосование по Ирландскому Федеральному Округу как обычно подавать через МФЦ."", ""Конор Макгрегор заявил, что будет баллотироваться в президенты Ирландии: он призвал голосовать за него на предстоящих выборах. @NeoficialniyBeZsonoV""]"
